{
  "spec_version": "0.9.0",
  "assurance_level": "AL3",
  "implementation": {
    "name": "Example TIS v0.9 Backed Enterprise Agent",
    "version": "3.0.0",
    "organization": "Example Enterprise Ltd",
    "jurisdiction": "IN",
    "deployment_environment": "production",
    "public_endpoint": "https://agents.example.invalid/tis-backed-enterprise"
  },
  "verification_tier": "AN-3",
  "conformance_profile": "Enterprise",
  "evidence_bundle": {
    "type": "path",
    "ref": "evidence-bundles/examples/al3-best-practice/bundle.json",
    "sha256": "3333333333333333333333333333333333333333333333333333333333333333"
  },
  "controls": {
    "ANAGB-ABUSE-01": {
      "status": "implemented",
      "evidence": "evidence://anagb-abuse-01"
    },
    "ANAGB-ABUSE-02": {
      "status": "implemented",
      "evidence": "evidence://anagb-abuse-02"
    },
    "ANAGB-AGT-01": {
      "status": "implemented",
      "evidence": "evidence://anagb-agt-01",
      "notes": "Operator binding is supported by VTI authorization credential evidence and public Agent Page disclosure."
    },
    "ANAGB-AGT-02": {
      "status": "implemented",
      "evidence": "evidence://anagb-agt-02"
    },
    "ANAGB-AI-01": {
      "status": "implemented",
      "evidence": "evidence://anagb-ai-01"
    },
    "ANAGB-AI-02": {
      "status": "implemented",
      "evidence": "evidence://anagb-ai-02"
    },
    "ANAGB-AI-03": {
      "status": "implemented",
      "evidence": "evidence://anagb-ai-03"
    },
    "ANAGB-AI-04": {
      "status": "implemented",
      "evidence": "evidence://anagb-ai-04"
    },
    "ANAGB-AI-05": {
      "status": "implemented",
      "evidence": "evidence://anagb-ai-05"
    },
    "ANAGB-AI-06": {
      "status": "implemented",
      "evidence": "evidence://anagb-ai-06"
    },
    "ANAGB-IR-01": {
      "status": "implemented",
      "evidence": "evidence://anagb-ir-01"
    },
    "ANAGB-IR-02": {
      "status": "implemented",
      "evidence": "evidence://anagb-ir-02"
    },
    "ANAGB-IR-03": {
      "status": "implemented",
      "evidence": "evidence://anagb-ir-03"
    },
    "ANAGB-IR-04": {
      "status": "implemented",
      "evidence": "evidence://anagb-ir-04"
    },
    "ANAGB-LOG-01": {
      "status": "implemented",
      "evidence": "evidence://anagb-log-01",
      "notes": "Audit trail includes a TIS decision receipt and DCAS evaluation result pointer."
    },
    "ANAGB-LOG-02": {
      "status": "implemented",
      "evidence": "evidence://anagb-log-02"
    },
    "ANAGB-LOG-03": {
      "status": "implemented",
      "evidence": "evidence://anagb-log-03"
    },
    "ANAGB-PRIV-01": {
      "status": "implemented",
      "evidence": "evidence://anagb-priv-01"
    },
    "ANAGB-PRIV-02": {
      "status": "implemented",
      "evidence": "evidence://anagb-priv-02"
    },
    "ANAGB-PRIV-03": {
      "status": "implemented",
      "evidence": "evidence://anagb-priv-03"
    },
    "ANAGB-PRIV-04": {
      "status": "implemented",
      "evidence": "evidence://anagb-priv-04"
    },
    "ANAGB-PRIV-05": {
      "status": "implemented",
      "evidence": "evidence://anagb-priv-05"
    },
    "ANAGB-PRIV-06": {
      "status": "implemented",
      "evidence": "evidence://anagb-priv-06"
    },
    "ANAGB-RES-01": {
      "status": "implemented",
      "evidence": "evidence://anagb-res-01",
      "notes": "Resolution evidence includes a DTG VC envelope and TIS evidence bundle manifest reference."
    },
    "ANAGB-RES-02": {
      "status": "implemented",
      "evidence": "evidence://anagb-res-02"
    },
    "ANAGB-RES-03": {
      "status": "implemented",
      "evidence": "evidence://anagb-res-03"
    },
    "ANAGB-RES-04": {
      "status": "implemented",
      "evidence": "evidence://anagb-res-04"
    },
    "ANAGB-RES-05": {
      "status": "implemented",
      "evidence": "evidence://anagb-res-05"
    },
    "ANAGB-RES-06": {
      "status": "implemented",
      "evidence": "evidence://anagb-res-06"
    },
    "ANAGB-UI-01": {
      "status": "implemented",
      "evidence": "evidence://anagb-ui-01"
    },
    "ANAGB-UI-02": {
      "status": "implemented",
      "evidence": "evidence://anagb-ui-02"
    },
    "ANAGB-UI-03": {
      "status": "implemented",
      "evidence": "evidence://anagb-ui-03"
    },
    "ANAGB-A2A-01": {
      "status": "implemented",
      "notes": "Signed Agent Card or equivalent integrity control published."
    },
    "ANAGB-A2A-02": {
      "status": "implemented",
      "notes": "Agent Page, Agent Card, and declaration kept consistent by release checks."
    },
    "ANAGB-A2A-03": {
      "status": "implemented",
      "notes": "Extended metadata disclosed only after auth where applicable."
    },
    "ANAGB-A2A-04": {
      "status": "implemented",
      "notes": "Task, context, and tenant identifiers authorization scoped."
    },
    "ANAGB-A2A-05": {
      "status": "implemented",
      "notes": "Streaming or callback channels require authenticity checks and replay mitigation."
    },
    "ANAGB-A2A-06": {
      "status": "implemented",
      "notes": "Supported media types declared and unsupported content safely rejected."
    },
    "ANAGB-A2A-07": {
      "status": "implemented",
      "notes": "Agent Card trust metadata references the TIS evidence bundle manifest and preserves accountable operator binding."
    },
    "ANAGB-A2A-08": {
      "status": "implemented",
      "notes": "Verified identity status discloses issuer, verification method, and verifier-facing interpretation policy."
    },
    "ANAGB-A2A-09": {
      "status": "implemented",
      "notes": "Freshness and revocation interpretation reference OpenVTC relationship state and TIS decision receipt evidence."
    },
    "ANAGB-A2A-10": {
      "status": "implemented",
      "notes": "Clients fail safely when ANAB extension metadata is absent, stale, or unverifiable."
    }
  },
  "exceptions": [],
  "declaration": {
    "authorized_signatory": "Jane Doe",
    "title": "Security Lead",
    "date": "2026-02-27"
  },
  "standards_alignment": [
    {
      "standard_id": "ISO42001",
      "standard_name": "ISO/IEC 42001",
      "crosswalk_ref": "crosswalk/ai-governance.yml",
      "notes": "Illustrative mapping for a DCAS evaluator."
    },
    {
      "standard_id": "TIS090",
      "standard_name": "trust-infrastructure-schemas",
      "standard_version": "v0.9.0",
      "notes": "References TIS DTG/OpenVTC/VTI runtime trust artifact profiles as supporting evidence for ANAB controls."
    },
    {
      "standard_id": "DCAS080",
      "standard_name": "DTG Conformance and Assurance Standard",
      "standard_version": "v0.8.0",
      "notes": "Illustrative DCAS evaluation pointer for relying-party assurance interpretation."
    }
  ]
}
